{
  "name": "Substance",
  "symbol": "SUBSTANCE",
  "description": "Elemental Substance token of the Alchm protocol representing the Air axis (Mercury / Sublimation). Governs dialectic agility, intellectual framing, and JEPA latent persona reasoning vectors.",
  "image": null,
  "decimals": 4,
  "attributes": [
    {
      "trait_type": "Element",
      "value": "Air"
    },
    {
      "trait_type": "Decimals",
      "value": 4
    },
    {
      "trait_type": "Soulbound",
      "value": "Non-Transferable"
    },
    {
      "trait_type": "BurnAuthority",
      "value": "Permissioned"
    }
  ]
}
