{
  "name": "Spirit",
  "symbol": "SPIRIT",
  "description": "Elemental Spirit token of the Alchm protocol representing the Fire axis (Sun / Volatile). Governs projective dynamic energy, creative initiative, and JEPA latent persona drive vectors.",
  "image": "https://arweave.net/B7CNd8mYcWu73i8EjeRmhP3Ni9xbLf2mdrysq1pHd9mu",
  "decimals": 4,
  "attributes": [
    {
      "trait_type": "Element",
      "value": "Fire"
    },
    {
      "trait_type": "Decimals",
      "value": 4
    },
    {
      "trait_type": "Soulbound",
      "value": "Non-Transferable"
    },
    {
      "trait_type": "BurnAuthority",
      "value": "Permissioned"
    }
  ]
}
